{"experiment_id": 1, "timestamp": "2026-03-14T00:15:52Z", "commit": "a21283c", "hypothesis": "baseline", "category": "baseline", "change_summary": "baseline run \u2014 no changes", "files_changed": [], "metric_name": "val_loss", "metric_value": 0.201502, "metric_direction": "minimize", "secondary_metrics": {"training_seconds": 60.2, "total_seconds": 60.3, "peak_memory_mb": 2.0, "num_steps": 15535.0, "num_params": 35329.0, "device": "mps", "device_name": "Apple M2"}, "status": "keep", "reasoning": "", "parent_experiment": 0, "platform_device": "mps", "platform_name": "Apple M2"}
{"experiment_id": 2, "timestamp": "2026-03-14T00:16:59Z", "commit": "1fada15", "hypothesis": "LEARNING_RATE = 0.0003 (was 0.001)", "category": "hyperparameter", "change_summary": "Sweep LEARNING_RATE: testing 0.0003 against current 0.001", "files_changed": ["train.py"], "metric_name": "val_loss", "metric_value": 0.205556, "metric_direction": "minimize", "secondary_metrics": {"training_seconds": 60.2, "total_seconds": 60.3, "peak_memory_mb": 1.9, "num_steps": 15210.0, "num_params": 35329.0, "device": "mps", "device_name": "Apple M2"}, "status": "discard", "reasoning": "", "parent_experiment": 0, "platform_device": "mps", "platform_name": "Apple M2"}
{"experiment_id": 3, "timestamp": "2026-03-14T00:18:04Z", "commit": "4f5286d", "hypothesis": "LEARNING_RATE = 0.003 (was 0.001)", "category": "hyperparameter", "change_summary": "Sweep LEARNING_RATE: testing 0.003 against current 0.001", "files_changed": ["train.py"], "metric_name": "val_loss", "metric_value": 0.19289, "metric_direction": "minimize", "secondary_metrics": {"training_seconds": 60.2, "total_seconds": 60.4, "peak_memory_mb": 2.0, "num_steps": 13065.0, "num_params": 35329.0, "device": "mps", "device_name": "Apple M2"}, "status": "keep", "reasoning": "", "parent_experiment": 0, "platform_device": "mps", "platform_name": "Apple M2"}
{"experiment_id": 4, "timestamp": "2026-03-14T00:19:11Z", "commit": "3b67cc7", "hypothesis": "LEARNING_RATE = 0.01 (was 0.003)", "category": "hyperparameter", "change_summary": "Sweep LEARNING_RATE: testing 0.01 against current 0.003", "files_changed": ["train.py"], "metric_name": "val_loss", "metric_value": 0.188566, "metric_direction": "minimize", "secondary_metrics": {"training_seconds": 60.1, "total_seconds": 60.3, "peak_memory_mb": 1.9, "num_steps": 13390.0, "num_params": 35329.0, "device": "mps", "device_name": "Apple M2"}, "status": "keep", "reasoning": "", "parent_experiment": 0, "platform_device": "mps", "platform_name": "Apple M2"}
{"experiment_id": 5, "timestamp": "2026-03-14T00:20:19Z", "commit": "a1f8198", "hypothesis": "BATCH_SIZE = 64 (was 256)", "category": "hyperparameter", "change_summary": "Sweep BATCH_SIZE: testing 64 against current 256", "files_changed": ["train.py"], "metric_name": "val_loss", "metric_value": 0.208161, "metric_direction": "minimize", "secondary_metrics": {"training_seconds": 60.3, "total_seconds": 60.4, "peak_memory_mb": 1.6, "num_steps": 24510.0, "num_params": 35329.0, "device": "mps", "device_name": "Apple M2"}, "status": "discard", "reasoning": "", "parent_experiment": 0, "platform_device": "mps", "platform_name": "Apple M2"}
{"experiment_id": 6, "timestamp": "2026-03-14T00:21:24Z", "commit": "8bdc153", "hypothesis": "BATCH_SIZE = 128 (was 256)", "category": "hyperparameter", "change_summary": "Sweep BATCH_SIZE: testing 128 against current 256", "files_changed": ["train.py"], "metric_name": "val_loss", "metric_value": 0.195503, "metric_direction": "minimize", "secondary_metrics": {"training_seconds": 60.1, "total_seconds": 60.2, "peak_memory_mb": 1.7, "num_steps": 30960.0, "num_params": 35329.0, "device": "mps", "device_name": "Apple M2"}, "status": "discard", "reasoning": "", "parent_experiment": 0, "platform_device": "mps", "platform_name": "Apple M2"}
{"experiment_id": 7, "timestamp": "2026-03-14T00:22:27Z", "commit": "de1a40c", "hypothesis": "BATCH_SIZE = 512 (was 256)", "category": "hyperparameter", "change_summary": "Sweep BATCH_SIZE: testing 512 against current 256", "files_changed": ["train.py"], "metric_name": "val_loss", "metric_value": 0.189806, "metric_direction": "minimize", "secondary_metrics": {"training_seconds": 60.0, "total_seconds": 60.1, "peak_memory_mb": 3.0, "num_steps": 29832.0, "num_params": 35329.0, "device": "mps", "device_name": "Apple M2"}, "status": "discard", "reasoning": "", "parent_experiment": 0, "platform_device": "mps", "platform_name": "Apple M2"}
{"experiment_id": 8, "timestamp": "2026-03-14T00:23:31Z", "commit": "53e06e2", "hypothesis": "DROPOUT = 0.0 (was 0.05)", "category": "hyperparameter", "change_summary": "Sweep DROPOUT: testing 0.0 against current 0.05", "files_changed": ["train.py"], "metric_name": "val_loss", "metric_value": 0.220774, "metric_direction": "minimize", "secondary_metrics": {"training_seconds": 60.0, "total_seconds": 60.1, "peak_memory_mb": 1.7, "num_steps": 35165.0, "num_params": 35329.0, "device": "mps", "device_name": "Apple M2"}, "status": "discard", "reasoning": "", "parent_experiment": 0, "platform_device": "mps", "platform_name": "Apple M2"}
{"experiment_id": 9, "timestamp": "2026-03-14T00:24:34Z", "commit": "bbace15", "hypothesis": "DROPOUT = 0.1 (was 0.05)", "category": "hyperparameter", "change_summary": "Sweep DROPOUT: testing 0.1 against current 0.05", "files_changed": ["train.py"], "metric_name": "val_loss", "metric_value": 0.197622, "metric_direction": "minimize", "secondary_metrics": {"training_seconds": 60.1, "total_seconds": 60.1, "peak_memory_mb": 1.9, "num_steps": 30160.0, "num_params": 35329.0, "device": "mps", "device_name": "Apple M2"}, "status": "discard", "reasoning": "", "parent_experiment": 0, "platform_device": "mps", "platform_name": "Apple M2"}
{"experiment_id": 10, "timestamp": "2026-03-14T00:25:37Z", "commit": "0a418d5", "hypothesis": "DROPOUT = 0.2 (was 0.05)", "category": "hyperparameter", "change_summary": "Sweep DROPOUT: testing 0.2 against current 0.05", "files_changed": ["train.py"], "metric_name": "val_loss", "metric_value": 0.200515, "metric_direction": "minimize", "secondary_metrics": {"training_seconds": 60.1, "total_seconds": 60.1, "peak_memory_mb": 2.0, "num_steps": 30225.0, "num_params": 35329.0, "device": "mps", "device_name": "Apple M2"}, "status": "discard", "reasoning": "", "parent_experiment": 0, "platform_device": "mps", "platform_name": "Apple M2"}
{"experiment_id": 11, "timestamp": "2026-03-14T00:29:01Z", "commit": "c801cba", "hypothesis": "LEARNING_RATE = 0.0003 (was 0.01)", "category": "hyperparameter", "change_summary": "Sweep LEARNING_RATE: testing 0.0003 against current 0.01", "files_changed": ["train.py"], "metric_name": "val_loss", "metric_value": 0.198812, "metric_direction": "minimize", "secondary_metrics": {"training_seconds": 60.1, "total_seconds": 60.2, "peak_memory_mb": 2.0, "num_steps": 39195.0, "num_params": 35329.0, "device": "mps", "device_name": "Apple M2"}, "status": "discard", "reasoning": "", "parent_experiment": 0, "platform_device": "mps", "platform_name": "Apple M2"}
{"experiment_id": 12, "timestamp": "2026-03-14T00:30:04Z", "commit": "0d6165c", "hypothesis": "LEARNING_RATE = 0.001 (was 0.01)", "category": "hyperparameter", "change_summary": "Sweep LEARNING_RATE: testing 0.001 against current 0.01", "files_changed": ["train.py"], "metric_name": "val_loss", "metric_value": 0.194033, "metric_direction": "minimize", "secondary_metrics": {"training_seconds": 60.1, "total_seconds": 60.1, "peak_memory_mb": 2.0, "num_steps": 39455.0, "num_params": 35329.0, "device": "mps", "device_name": "Apple M2"}, "status": "discard", "reasoning": "", "parent_experiment": 0, "platform_device": "mps", "platform_name": "Apple M2"}
